{
  "schema_version": "1.0",
  "farm_id": "farm_001",
  "farm_name": "AgroMind Synthetic Demo Farm",
  "location": {
    "latitude": 33.97,
    "longitude": -6.87,
    "timezone": "Africa/Casablanca"
  },
  "crop_defaults": {
    "type": "tomato",
    "variety": "demo_variety",
    "growth_stage": "fruit_development",
    "soil_type": "loam"
  },
  "zones": [
    {
      "zone_id": "Z01",
      "area_ha": 5.12,
      "crop": {
        "type": "tomato",
        "variety": "demo_variety",
        "growth_stage": "fruit_development",
        "soil_type": "loam"
      },
      "sensors": [
        {
          "record_id": "sensor_Z01_soil_moisture_001",
          "field": "soil_moisture",
          "value": 37.0,
          "unit": "percent_vwc",
          "measured_at": "2026-10-24T09:55:00Z",
          "quality": "valid"
        },
        {
          "record_id": "sensor_Z01_nitrogen_001",
          "field": "nitrogen",
          "value": 41.7,
          "unit": "mg/kg",
          "measured_at": "2026-10-24T09:55:00Z",
          "quality": "valid",
          "depth_cm": null
        }
      ]
    },
    {
      "zone_id": "Z02",
      "area_ha": 3.91,
      "crop": {
        "type": "tomato",
        "variety": "demo_variety",
        "growth_stage": "fruit_development",
        "soil_type": "loam"
      },
      "sensors": [
        {
          "record_id": "sensor_Z02_soil_moisture_001",
          "field": "soil_moisture",
          "value": 11.8,
          "unit": "percent_vwc",
          "measured_at": "2026-10-24T09:55:00Z",
          "quality": "valid"
        },
        {
          "record_id": "sensor_Z02_nitrogen_001",
          "field": "nitrogen",
          "value": 41.6,
          "unit": "mg/kg",
          "measured_at": "2026-10-24T09:55:00Z",
          "quality": "valid",
          "depth_cm": null
        }
      ]
    },
    {
      "zone_id": "Z03",
      "area_ha": 2.54,
      "crop": {
        "type": "tomato",
        "variety": "demo_variety",
        "growth_stage": "fruit_development",
        "soil_type": "loam"
      },
      "sensors": [
        {
          "record_id": "sensor_Z03_soil_moisture_001",
          "field": "soil_moisture",
          "value": 31.1,
          "unit": "percent_vwc",
          "measured_at": "2026-10-24T09:55:00Z",
          "quality": "valid"
        },
        {
          "record_id": "sensor_Z03_nitrogen_001",
          "field": "nitrogen",
          "value": 12.1,
          "unit": "mg/kg",
          "measured_at": "2026-10-24T09:55:00Z",
          "quality": "valid",
          "depth_cm": null
        }
      ]
    },
    {
      "zone_id": "Z04",
      "area_ha": 5.41,
      "crop": {
        "type": "tomato",
        "variety": "demo_variety",
        "growth_stage": "fruit_development",
        "soil_type": "loam"
      },
      "sensors": [
        {
          "record_id": "sensor_Z04_soil_moisture_001",
          "field": "soil_moisture",
          "value": 17.5,
          "unit": "percent_vwc",
          "measured_at": "2026-10-24T09:55:00Z",
          "quality": "valid"
        },
        {
          "record_id": "sensor_Z04_nitrogen_001",
          "field": "nitrogen",
          "value": 16.8,
          "unit": "mg/kg",
          "measured_at": "2026-10-24T09:55:00Z",
          "quality": "valid",
          "depth_cm": null
        }
      ]
    },
    {
      "zone_id": "Z05",
      "area_ha": 4.47,
      "crop": {
        "type": "tomato",
        "variety": "demo_variety",
        "growth_stage": "fruit_development",
        "soil_type": "loam"
      },
      "sensors": [
        {
          "record_id": "sensor_Z05_soil_moisture_001",
          "field": "soil_moisture",
          "value": null,
          "unit": "percent_vwc",
          "measured_at": "2026-10-24T09:55:00Z",
          "quality": "missing"
        },
        {
          "record_id": "sensor_Z05_nitrogen_001",
          "field": "nitrogen",
          "value": null,
          "unit": "mg/kg",
          "measured_at": "2026-10-24T09:55:00Z",
          "quality": "missing",
          "depth_cm": null
        }
      ]
    },
    {
      "zone_id": "Z06",
      "area_ha": 4.22,
      "crop": {
        "type": "tomato",
        "variety": "demo_variety",
        "growth_stage": "fruit_development",
        "soil_type": "loam"
      },
      "sensors": [
        {
          "record_id": "sensor_Z06_soil_moisture_001",
          "field": "soil_moisture",
          "value": 9.9,
          "unit": "percent_vwc",
          "measured_at": "2026-10-24T09:55:00Z",
          "quality": "suspect"
        },
        {
          "record_id": "sensor_Z06_nitrogen_001",
          "field": "nitrogen",
          "value": 37.4,
          "unit": "mg/kg",
          "measured_at": "2026-10-24T09:55:00Z",
          "quality": "valid",
          "depth_cm": null
        }
      ]
    },
    {
      "zone_id": "Z07",
      "area_ha": 4.13,
      "crop": {
        "type": "tomato",
        "variety": "demo_variety",
        "growth_stage": "fruit_development",
        "soil_type": "loam"
      },
      "sensors": [
        {
          "record_id": "sensor_Z07_soil_moisture_001",
          "field": "soil_moisture",
          "value": 33.1,
          "unit": "percent_vwc",
          "measured_at": "2026-10-24T09:55:00Z",
          "quality": "valid"
        },
        {
          "record_id": "sensor_Z07_nitrogen_001",
          "field": "nitrogen",
          "value": 43.0,
          "unit": "mg/kg",
          "measured_at": "2026-10-24T09:55:00Z",
          "quality": "valid",
          "depth_cm": null
        }
      ]
    },
    {
      "zone_id": "Z08",
      "area_ha": 4.95,
      "crop": {
        "type": "tomato",
        "variety": "demo_variety",
        "growth_stage": "fruit_development",
        "soil_type": "loam"
      },
      "sensors": [
        {
          "record_id": "sensor_Z08_soil_moisture_001",
          "field": "soil_moisture",
          "value": 15.0,
          "unit": "percent_vwc",
          "measured_at": "2026-10-24T09:55:00Z",
          "quality": "valid"
        },
        {
          "record_id": "sensor_Z08_nitrogen_001",
          "field": "nitrogen",
          "value": 46.4,
          "unit": "mg/kg",
          "measured_at": "2026-10-24T09:55:00Z",
          "quality": "valid",
          "depth_cm": null
        }
      ]
    },
    {
      "zone_id": "Z09",
      "area_ha": 5.07,
      "crop": {
        "type": "tomato",
        "variety": "demo_variety",
        "growth_stage": "fruit_development",
        "soil_type": "loam"
      },
      "sensors": [
        {
          "record_id": "sensor_Z09_soil_moisture_001",
          "field": "soil_moisture",
          "value": 38.9,
          "unit": "percent_vwc",
          "measured_at": "2026-10-24T09:55:00Z",
          "quality": "valid"
        },
        {
          "record_id": "sensor_Z09_nitrogen_001",
          "field": "nitrogen",
          "value": 19.3,
          "unit": "mg/kg",
          "measured_at": "2026-10-24T09:55:00Z",
          "quality": "valid",
          "depth_cm": null
        }
      ]
    },
    {
      "zone_id": "Z10",
      "area_ha": 2.86,
      "crop": {
        "type": "tomato",
        "variety": "demo_variety",
        "growth_stage": "fruit_development",
        "soil_type": "loam"
      },
      "sensors": [
        {
          "record_id": "sensor_Z10_soil_moisture_001",
          "field": "soil_moisture",
          "value": 32.4,
          "unit": "percent_vwc",
          "measured_at": "2026-10-24T09:55:00Z",
          "quality": "valid"
        },
        {
          "record_id": "sensor_Z10_nitrogen_001",
          "field": "nitrogen",
          "value": 62.4,
          "unit": "mg/kg",
          "measured_at": "2026-10-24T09:55:00Z",
          "quality": "valid",
          "depth_cm": null
        }
      ]
    },
    {
      "zone_id": "Z11",
      "area_ha": 2.16,
      "crop": {
        "type": "tomato",
        "variety": "demo_variety",
        "growth_stage": "fruit_development",
        "soil_type": "loam"
      },
      "sensors": [
        {
          "record_id": "sensor_Z11_soil_moisture_001",
          "field": "soil_moisture",
          "value": 19.0,
          "unit": "percent_vwc",
          "measured_at": "2026-10-24T09:55:00Z",
          "quality": "valid"
        },
        {
          "record_id": "sensor_Z11_nitrogen_001",
          "field": "nitrogen",
          "value": 14.1,
          "unit": "mg/kg",
          "measured_at": "2026-10-24T09:55:00Z",
          "quality": "valid",
          "depth_cm": null
        }
      ]
    },
    {
      "zone_id": "Z12",
      "area_ha": 5.49,
      "crop": {
        "type": "tomato",
        "variety": "demo_variety",
        "growth_stage": "fruit_development",
        "soil_type": "loam"
      },
      "sensors": [
        {
          "record_id": "sensor_Z12_soil_moisture_001",
          "field": "soil_moisture",
          "value": null,
          "unit": "percent_vwc",
          "measured_at": "2026-10-24T09:55:00Z",
          "quality": "missing"
        },
        {
          "record_id": "sensor_Z12_nitrogen_001",
          "field": "nitrogen",
          "value": null,
          "unit": "mg/kg",
          "measured_at": "2026-10-24T09:55:00Z",
          "quality": "missing",
          "depth_cm": null
        }
      ]
    }
  ]
}
